<?xml version="1.0" encoding="UTF-8"?>
<!DOCTYPE catalog [
    <!ELEMENT catalog (book+)>
    <!ELEMENT book (title, author, price)>
    <!ELEMENT title (#PCDATA)>
    <!ELEMENT author (#PCDATA)>
    <!ELEMENT price (#PCDATA)>
    <!ATTLIST book id ID #REQUIRED>
]>
<catalog>
    <book id="b1">
        <title>The Great Gatsby</title>
        <author>F. Scott Fitzgerald</author>
        <price>10.99</price>
    </book>
    <book id="b2">
        <title>1984</title>
        <author>George Orwell</author>
        <price>8.99</price>
    </book>
    <book id="b3">
        <title>To Kill a Mockingbird</title>
        <author>Harper Lee</author>
        <price>12.99</price>
    </book>
    <book id="b4">
        <title>Pride and Prejudice</title>
        <author>Jane Austen</author>
        <price>9.99</price>
    </book>
    <book id="b5">
        <title>The Catcher in the Rye</title>
        <author>J.D. Salinger</author>
        <price>11.99</price>
    </book>
</catalog>
